index,id,periodeid,nummer,titel,titelkort,resume,afstemningskonklusion,ministeromraade,stem_S,stem_V,stem_SF,stem_RV,stem_EL,stem_DD,stem_KF,stem_DF,stem_NB,stem_LA,stem_FG,stem_ALT,stem_KD,stem_M,raekkenr
152,86883,153,L 150,"Forslag til lov om ændring af ligningsloven, kildeskatteloven og selskabsskatteloven. (Fastsættelse af defensive foranstaltninger mod lande på EU-listen over ikkesamarbejdsvillige skattejurisdiktioner).",Om foranstaltninger mod lande på EU-listen over ikkesamarbejdsvillige skattejurisdiktioner.,"Lovforslaget handler om at indføre to defensive foranstaltninger mod landene på EU’s liste over ikke-samarbejdsvillige skattejurisdiktioner (sortlisten).

For det første skal der ske en nægtelse af fradrag for visse betalinger, så personer og selskaber m.v. som udgangspunkt ikke skal kunne fradrage betalinger til interesseforbundne modtagere i lande på sortlisten, ligesom sådanne betalinger heller ikke på anden måde skal kunne indgå ved opgørelsen af den skattepligtige indkomst.

For det andet skal der ske en skærpelse af udbyttebeskatningen, så personer og selskaber, der er hjemmehørende i lande på sortlisten, og som modtager udbytte af hovedaktionæraktier, datterselskabsaktier eller koncernselskabsaktier, som udgangspunkt skal betale en endelig bruttoskat på 44 pct. af sådanne udbytter, der betales ved indeholdelse.

Lovforslaget udmønter Rådet for Den Europæiske Unions beslutning fra december 2019 om, at alle medlemsstater med virkning fra og med 2021 skal indføre mindst et af fire mulige tiltag om defensive foranstaltninger i national ret mod lande på EU’s sortliste.

Lovforslaget er omfattet af de fælles ikrafttrædelsesdatoer, hvorfor det foreslås, at loven træder i kraft den 1. juli 2021.

Ved ændringsforslag udgik Barbados af listen over lande, der berøres af de foreslåede defensive foranstaltninger, mens Dominica blev optaget på listen.
","Forslaget blev vedtaget. For stemte 93 (S, V, DF, SF, RV, EL, KF, LA og Uffe Elbæk (UFG)), imod stemte 0, hverken for eller imod stemte 2 (NB).",Skatteministeriet,1.0,1.0,1.0,1.0,1.0,,1.0,1.0,,1.0,,,,,0
167,87103,153,L 161,"Forslag til lov om ændring af ligningsloven og lov om spil. (Lempelse af boligjobordningen i 2021, skattefritagelse af visse arbejdsgiverbetalte gavekort til oplevelsesøkonomi i 2021, af arbejdsgiverbetalte covid-19-test m.v. og af tilbagebetalt covid-19-støtte og nedsættelse af procentsatsen for det særlige bidrag til hestevæddeløbssporten).",Om lempelse af BoligJobordningen og skattefritagelse af visse arbejdsgiverbetalte gavekort i 2021 m.v.,"Med lovforslaget foreslås en midlertidig lempelse af boligjobordningen, således at loftet for serviceydelser hæves til 25.000 kr., og fradragsværdien øges til 35 pct. for serviceydelser. Loftet for håndværksydelser foreslås ligeledes hævet til 25.000 kr.

Desuden foreslås det at indføre en særskilt skattefritagelse i 2021 af gavekort med en beløbsgrænse på 1.200 kr., som kan benyttes i oplevelsesøkonomien.

Endvidere foreslås det at nedsætte det særlige bidrag som spiludbydere betaler til hestevæddeløbssporten fra 8 til 6 pct.

Disse dele af lovforslaget udspringer af aftale om finansloven for 2021 indgået mellem regeringen (Socialdemokratiet), Radikale Venstre, Socialistisk Folkeparti, Enhedslisten og Alternativet.

Endeligt foreslås det at skattefritage arbejdsgiverbetalte covid-19-tests og værnemidler, at sikre arbejdsgiver fradragsret for udgifter til tests og værnemidler og at skattefritage covid-19-støtte, som er tilbagebetalt senest 3 år efter modtagelsen. 
","Forslaget blev vedtaget. For stemte 95 (S, V, DF, SF, RV, EL, KF, NB, LA, Susanne Zimmer (UFG) og Uffe Elbæk (UFG)), imod stemte 0, hverken for eller imod stemte 0.",Skatteministeriet,1.0,1.0,1.0,1.0,1.0,,1.0,1.0,1.0,1.0,,,,,1
230,88368,153,L 221,Forslag til lov om ændring af tobaksafgiftsloven. (Skærpede krav til og styrket kontrol med handel og opbevaring af tobak).,Om skærpede krav til og styrket kontrol med handel og opbevaring af tobak.,"Lovforslaget handler om, at der indføres et forbud mod salg af cigaretter og røgtobak med stempelmærker med ”gammel” afgift 3 måneder efter, at en afgiftsforhøjelse er trådt i kraft.

Endvidere foreslås det at indføre bødestraf for grossister og detailhandlere m.v. for salg og opbevaring af cigaretter og røgtobak med ”gamle” stempelmærker efter de fastsatte frister på henholdsvis 3 måneder for salg og 4 måneder for opbevaring efter afgiftsforhøjelsen.

Lovforslaget udmønter dele af regeringens handleplan om skærpede krav og styrket kontrol med handel af tobak.
","Forslaget blev vedtaget. For stemte 84 (S, V, DF, SF, RV, EL, ALT, KD, Inger Støjberg (UFG), Susanne Zimmer (UFG) og Uffe Elbæk (UFG)), imod stemte 11 ( KF, NB, LA og 1 V (fejlafstemning)), hverken for eller imod stemte 0.",Skatteministeriet,1.0,1.0,1.0,1.0,1.0,,0.0,1.0,0.0,0.0,,1.0,1.0,,2
136,86582,153,L 133,Forslag til lov om ændring af dødsboskatteloven og kildeskatteloven. (Indgreb mod skatteundgåelse ved overtagelse af virksomhed i virksomhedsordningen).,Om indgreb mod skatteundgåelse ved overtagelse af virksomhed i virksomhedsordningen.,"Lovforslaget har til formål at justere en række beskatningsregler med henblik på at hindre, at der i forbindelse med overtagelse af en virksomhed i virksomhedsordningen kan ske en utilsigtet udnyttelse af de gældende regler.

Det foreslås at ændre reglerne, så den selvstændigt erhvervsdrivende, der anvender virksomhedsordningen, ikke kan foretage en overdragelse af en virksomhed, en del af en virksomhed eller en del af flere virksomheder til nærtstående, uden at der samtidig sker en overdragelse af de aktiver og passiver (kapitalafkastgrundlaget) i ordningen, der svarer til den andel af det opsparede overskud, der bliver overdraget. Herved sikres en sammenhæng mellem værdierne i virksomhedsordningen og den latente skatteforpligtelse, som konto for opsparet overskud er udtryk for. Der foreslås desuden en tilsvarende sammenhæng i den situation, hvor virksomheden overtages i forbindelse med død.

Med lovforslaget afskæres en række omgåelsesmuligheder i de gældende regler i dødsboskatteloven og kildeskatteloven vedrørende virksomhedsordningen, der muliggør, at midler i virksomhedsordningen kan hæves uden om det opsparede overskud, så det ikke kommer til beskatning.

Det foreslås, at loven træder i kraft dagen efter bekendtgørelsen i Lovtidende. Det foreslås, at loven har virkning fra fremsættelsestidspunktet, idet der er risiko for spekulation i de stramninger af reglerne, som foreslås gennemført ved lovforslaget. 
","Forslaget blev vedtaget. For stemte 61 (S, DF, SF, RV, EL, LA, Susanne Zimmer (UFG) og Uffe Elbæk (UFG)), imod stemte 35 (V, KF, NB, KD og Inger Støjberg (UFG)), hverken for eller imod stemte 0.",Skatteministeriet,1.0,0.0,1.0,1.0,1.0,,0.0,1.0,0.0,1.0,,,0.0,,3
304,89966,155,L 56,Forslag til lov om indfødsrets meddelelse.,Om indfødsrets meddelelse.,"Lovforslaget er det første af samlingens to lovforslag om de personer, der ved lov kan få meddelt indfødsret (statsborgerskab) i Danmark. ","Forslaget blev vedtaget. For stemte 78 (S, V, SF, RV, EL, LA, FG og ALT), imod stemte 13 (DF og NB), hverken for eller imod stemte 7 (KF). 
Ved en fejl er Rasmus Helveg Petersens (RV) stemme registreret i Henrik Dam Kristensens (S) navn.",Udlændinge- og Integrationsministeriet,1.0,1.0,1.0,1.0,1.0,,,0.0,0.0,1.0,1.0,1.0,,,4
82,85678,153,L 93,"Forslag til lov om ændring af udlændingeloven. (Gebyr på ansøgninger om Working Holiday-tilladelser og indførelse af afvisningshjemmel, hvis en kvote på antallet af Working Holiday-tilladelser udnyttes m.v.).",Om gebyr på ansøgninger om Working Holiday-tilladelser m.v.,"Lovforslaget implementerer de dele af aftalen mellem regeringen (Socialdemokratiet), Socialistisk Folkeparti, Enhedslisten og Dansk Folkeparti indgået den 18. december 2019 om ændringer af Working Holiday-ordningen, som kræver justeringer af udlændingeloven.

Udlændingeloven ændres, så der kan indføres et gebyr på ansøgninger under ordningen, og således at der kan fastsættes kvoter for antallet af modtagere af Working Holiday-tilladelser fra visse lande (Argentina og Chile) baseret på først til mølle-princippet. ","Forslaget blev vedtaget. For stemte 54 (S, DF, SF, EL, Susanne Zimmer (UFG) og Uffe Elbæk (UFG)), imod stemte 43 (V, RV, KF, NB, LA og ALT), hverken for eller imod stemte 0.",Udlændinge- og Integrationsministeriet,1.0,0.0,1.0,0.0,1.0,,0.0,1.0,0.0,0.0,,0.0,,,5
236,88485,153,L 230,"Forslag til lov om ændring af lov om dansk indfødsret. (Frakendelse af statsborgerskab for visse former for alvorlig bandekriminalitet, som er til alvorlig skade for statens vitale interesser).",Om frakendelse af statsborgerskab for visse former for alvorlig bandekriminalitet.,"Regeringen foreslår, at det gøres muligt, at alvorlig bandekriminalitet, der er til alvorlig skade for Danmarks vitale interesser, kan føre til frakendelse af dansk statsborgerskab ved dom, medmindre den pågældende derved bliver statsløs. Det foreslås, at lovforslaget træder i kraft den 1. juli 2021.
","Forslaget blev vedtaget. For stemte 78 (S, V, DF, SF (ved en fejl), KF, NB, LA og Inger Støjberg (UFG)), imod stemte 16 (RV, EL, ALT, Susanne Zimmer (UFG) og Uffe Elbæk (UFG)), hverken for eller imod stemte 0.",Udlændinge- og Integrationsministeriet,1.0,1.0,,0.0,0.0,,1.0,1.0,1.0,1.0,,0.0,,,6
226,88363,153,L 228,"Forslag til lov om ændring af udlændingeloven, lov om dansk indfødsret, integrationsloven og hjemrejseloven. (Indførelse af almindelig klageadgang på visumområdet, karensperiode i visse visumsager, tilvejebringelse af hjemmel til at udstede langtidsvisum til diplomater m.v., forskellige justeringer af reglerne for beskæftigelse, privat indkvartering og indkvartering i egen finansieret bolig for asylansøgere, tydeliggørelse af hjemmelen for iværksættelse af separat indkvartering af gifte eller samlevende mindreårige udlændinge, fuldbyrdelse af afgørelser om anbringelse af uledsagede mindreårige og genindførelse af erklæringsadgang for tidligere danske statsborgere m.v.).",Om forskellige ændringer på udlændingeområdet.,"Med lovforslaget ønskes der indført en række ændringer af udlændingelovens regler på visum- og asylområderne, som bl.a. skal forenkle sagsbehandlingen, gribe ind over for muligt misbrug af reglerne og skabe større klarhed om reglerne. Formålet er endvidere at gennemføre en ændring af lov om dansk indfødsret, så der frem til den 1. juli 2026 genindføres en erklæringsadgang for tidligere danske statsborgere samt en berigtigelse af integrationslovens § 22 om danskbonus.

Det foreslås, at ændringen af integrationsloven træder i kraft ved bekendtgørelse i Lovtidende, mens ændringerne af udlændingeloven og indfødsretsloven foreslås at træde i kraft den 1. juli 2021.
",,Udlændinge- og Integrationsministeriet,,,,,,,,,,,,,,,7
372,91001,155,L 110,Forslag til lov om Ledningsejerregistret.,Om Ledningsejerregistret.,"Formålet med lovforslaget er at omstrukturere lov om registrering af ledningsejere, så den får en mere logisk og sammenhængende opbygning. Formålet er desuden at gennemgå loven, så lovens bestemmelser kan blive afstemt med de nutidige forhold og få det indhold, der har været hensigten. Den gældende lov om registrering af ledningsejere fra 2004 foreslås derfor ophævet og erstattet af en ny hovedlov.

Det foreslås bl.a. at udvide lovens anvendelsesområde geografisk. Dette vil have den konsekvens, at nogle få nye ledningsejere vil blive omfattet af loven, men vil også gøre det lettere at få udleveret ledningsoplysninger for disse ledninger, når der f.eks. skal føres nye ledninger på eller i havbunden.

Lovforslaget foreslås at træde i kraft den 1. juli 2022. 
","Forslaget blev vedtaget. For stemte 101 (S, V, SF, RV, EL, KF, DF, NB, LA, FG, Bent Bøgsted (UFG), Hans Kristian Skibby (UFG), Marie Krarup (UFG) og Naser Khader (UFG)), imod stemte 0, hverken for eller imod stemte 0.","Klima-, Energi- og Forsyningsministeriet",1.0,1.0,1.0,1.0,1.0,,1.0,1.0,1.0,1.0,1.0,,,,8
87,85683,153,L 97,Forslag til lov om ændring af biobrændstofloven. (Ændring af krav om anvendelse af bæredygtige og avancerede biobrændstoffer i brændstof til landtransport m.v.).,Om ændring af krav om anvendelse af bæredygtige og avancerede biobrændstoffer i brændstof til landtransport m.v.,"Lovforslaget indeholder tre hovedpunkter:

1. Det fastholder iblandingskravet på 7,6 pct. og omfatter biobrændstoffer i benzin, diesel og gas leveret til landtransport i kalenderåret 2021.

2. Det fastsætter, at avancerede biobrændstoffer i kalenderåret 2021 skal udgøre mindst 0,3 pct. af en virksomheds samlede årlige salg af brændstoffer til landtransport målt efter energiindhold.

3. Klima-, energi- og forsyningsministeren bemyndiges til at begrænse biobrændstoffer produceret af råprodukter med høj risiko for indirekte ændringer i arealanvendelsen i at tælle med til opfyldelse af iblandingskravet.

Forslaget udmønter aftalen mellem regeringen (Socialdemokratiet), Venstre, Dansk Folkeparti, Radikale Venstre, Socialistisk Folkeparti, Konservative, Nye Borgerlige og Liberal Alliance om forhøjelse af iblandingskrav for biobrændstoffer i 2021 af 7. oktober 2020.
 
Loven træder i kraft den 1. januar 2021.","Forslaget blev vedtaget. For stemte 87 (S, V, DF, RV, SF, KF, NB og LA), imod stemte 8 (EL, Susanne Zimmer (UFG) og Uffe Elbæk (UFG)), hverken for eller imod stemte 0.","Klima-, Energi- og Forsyningsministeriet",1.0,1.0,1.0,1.0,0.0,,1.0,1.0,1.0,1.0,,,,,9
186,87301,153,L 171,"Forslag til lov om ændring af lov om naturgasforsyning, lov om fremme af vedvarende energi og forskellige andre love. (Indpasning af gas fra vedvarende energikilder, udbud af pristillæg for opgraderet biogas og andre gasser fra vedvarende energikilder, udbud af støtte til produktion af brændstoffer eller andre produkter fra elektricitet (power-to-x), justering af den økonomiske regulering af gasdistributionsselskaber og reglerne for gasdetailmarkedet og sidestillelse af regioner med kommuner i forhold til egenproduktion af elektricitet ved selskabsudskillelse m.v.).","Om indpasning af gas fra vedvarende energikilder, udbud af pristillæg for biogas og andre gasser fra vedvarende energikilder i lov om naturgasforsyning m.v.","Formålet med lovforslaget er at sikre indpasning af gas fra vedvarende energikilder, at få en effektiv regulering af danske gasdistributionsselskaber og at justere i markedsdesignet for det danske detailmarked for gas. Endvidere vil man med lovforslaget sikre, at der kan afholdes udbud af støtte til produktion af kemiske brændstoffer eller andre produkter fra elektricitet, power-to-x. Endelig sidestilles regioner med kommuner i forhold til egenproduktion af elektricitet ved selskabsudskillelse.

Den danske gassektor står over for en markant omstilling til et grønt gassystem med indpasning af gas fra vedvarende energikilder og forventning om et faldende gasforbrug og udfasning af anvendelsen af naturgas. 

Loven træder i kraft den 30. juni 2021. 
","Forslaget blev vedtaget. For stemte 94 (S, V, DF, SF, RV, EL, KF, NB, LA, ALT og KD), imod stemte 0, hverken for eller imod stemte 1 (Susanne Zimmer (UFG)).","Klima-, Energi- og Forsyningsministeriet",1.0,1.0,1.0,1.0,1.0,,1.0,1.0,1.0,1.0,,1.0,1.0,,10
31,84952,153,L 43,"Forslag til lov om ændring af lov om CO2-kvoter. (Tilpasning af regler som følge af ændringer i kvotedirektiv 2003/87/EF og tilhørende EU-retsakter forud for 4. kvotehandelsperiode, herunder justering af klageregler m.v.)",Om tilpasning af regler om CO2-kvoter som følge af ændringer i kvotedirektivet og tilhørende EU-retsakter m.v.,"Lovforslaget er primært af teknisk karakter og har til hovedformål at opdatere den danske CO2-kvotelovgivning, så loven afspejler ændringer i gældende EU-ret og anden relevant international klimaret.","Forslaget blev vedtaget. For stemte 96 (S, V, DF, RV, SF, EL, KF, NB, LA, ALT, Susanne Zimmer (UFG) og Uffe Elbæk (UFG)), imod stemte 0, hverken for eller imod stemte 0.","Klima-, Energi- og Forsyningsministeriet",1.0,1.0,1.0,1.0,1.0,,1.0,1.0,1.0,1.0,,1.0,,,11
371,91000,155,L 112,Forslag til lov om infrastruktur for alternative drivmidler til transport.,Om infrastruktur for alternative drivmidler til transport.,"Formålet med forslaget er at fastsætte krav om etablering og drift af offentligt tilgængelige ladepunkter til elektriske køretøjer på offentligt areal.  Forslaget indfører bl.a. hjemmel til, at kommunalbestyrelse og regionsråd kan indgå aftale på markedsvilkår med operatører af ladepunkter om ret til at virke som operatør af offentligt tilgængelige ladepunkter på kommunale og regionale arealer. 

Det følger også af forslaget, at operatører af offentligt tilgængelige ladepunkter på offentlige arealer skal stille udbredte betalingsløsninger til rådighed og acceptere almindelige betalingskort for opladning ved hurtigladere. 

Forslaget viderefører AFI-lovens eksisterende bestemmelser om gennemførelse af internationale konventioner og EU-regler om forhold vedrørende infrastruktur for alternative drivmidler, herunder AFI-direktivet.

Foreslået ikrafttræden er  den 1. april 2022.","Forslaget blev vedtaget. For stemte 101 (S, V, SF, RV, EL, KF, DF, LA, FG, ALT, Bent Bøgsted (UFG), Hans Kristian Skibby (UFG), Liselott Blixt (UFG)), imod stemte 0, hverken for eller imod stemte 1 (NB).",Transportministeriet,1.0,1.0,1.0,1.0,1.0,,1.0,1.0,,1.0,1.0,1.0,,,12
168,87104,153,L 158,Forslag til lov om ændring af lov om ændring af færdselsloven og lov om godkendelse og syn af køretøjer. (Ophævelse af revisionsbestemmelse).,Om ophævelse af revisionsbestemmelse i færdselsloven og lov om godkendelse og syn af køretøjer.,"Med lovforslaget foreslås en ophævelse af den revisionsbestemmelse af Tempo 100-ordningen, som indgik i lov nr. 385 vedtaget den 27. april 2016, og hvormed campingvogne og andre registreringspligtige påhængskøretøjer med en tilladt totalvægt på ikke over 3.500 kg. kan godkendes til at køre 100 km/t på motorveje. Ifølge revisionsbestemmelsen skulle transportministeren senest i folketingsåret 2020-21 fremsætte forslag om revision af lovens indflydelse på færdselssikkerhed med afsæt i trafiksikkerhedsmæssige data. 

En evaluering af ordningen foretaget i sommeren 2020 viser samlet set, at der ikke er en øget færdselssikkerhedsmæssig risiko ved at køre med påhængskøretøjer, der er Tempo 100-godkendte. På den baggrund foreslås revisionsbestemmelsen ophævet med dette lovforslag.","Forslaget blev vedtaget. For stemte 94 (S, V, DF, SF, RV, EL (ved en fejl), KF, NB og LA), imod stemte 2 (Susanne Zimmer (UFG) og 1 EL), hverken for eller imod stemte 0.",Transportministeriet,1.0,1.0,1.0,1.0,,,1.0,1.0,1.0,1.0,,,,,13
188,87305,153,L 167,Forslag til lov om ændring af lov om infrastruktur for alternative drivmidler. (Brugerinformation om fossile brændstoffer og alternative drivmidler).,Om brugerinformation om fossile brændstoffer og alternative drivmidler.,"Med lovforslaget gives transportministeren bemyndigelse til ved bekendtgørelse at implementere dele af AFI-direktivet (EU-direktiv 2014/94/EU af 22. oktober 2014) om etablering af infrastruktur for alternative brændstoffer i dansk lovgivning. 

Transportministeren kan med forslaget fastsætte nærmere regler om anvendelse af internationale konventioner og EU-regler om brugerinformation om fossile brændstoffer og alternative drivmidler, herunder om videregivelse af oplysninger om solgte køretøjer i Danmark og priser for drivmidler til brug for beregning og sammenligning af gennemsnitlige priser på fossile brændstoffer og alternative drivmidler for udvalgte bilsegmenter. 

Desuden foreslås indført hjemmel til, at transportministeren ved bekendtgørelse kan delegere sine beføjelser efter loven til myndigheder under Transportministeriet og fastsætte regler om klageadgang, herunder om afskæring af klageadgang. 

Loven træder i kraft dagen efter bekendtgørelse i Lovtidende. ","Forslaget blev vedtaget. For stemte 91 (S, V, DF, SF, RV, EL, KF og Susanne Zimmer (UFG)), imod stemte 4 (NB og LA), hverken for eller imod stemte 0.",Transportministeriet,1.0,1.0,1.0,1.0,1.0,,1.0,1.0,0.0,0.0,,,,,14
385,91137,155,L 122,Forslag til lov om ombygning af Aarhus H.,Om ombygning af Aarhus H.,"Forslaget giver hjemmel til at gennemføre ombygningen af Aarhus H, området omkring banegården og dertilhørende anlæg, som skal fremtidssikre stationen og klargøre den til ibrugtagning af DSB’s nye elektriske togmateriel, der skal køre på strækningen Fredericia-Aalborg fra ultimo 2026. 

Anlægsprojekterne drejer sig om fornyelsesaktiviteter, hastighedsopgradering, perronforlængelser, kapacitetsudvidelse og udrulning af Signalprogrammet og Elektrificeringsprogrammet. Ombygningen er planlagt som et samlet projekt, der udføres over 3 år i perioden 2024-2027. Udførelsen har været genstand for en miljøvurdering. 

Med forslaget bemyndiges ministeren til kunne at udstede regler om forurening og gener. Der indføres mulighed for at tilbyde støjpåvirkede borgere skattefri kompensation eller genhusning. Forslaget fraviger på en række punkter plan-, natur- og miljølovgivningen for at sikre fremdrift i projektet, da forsinkelse vil have betydelige trafikale og samfundsøkonomiske konsekvenser.

Foreslået ikrafttræden er 1. juli 2022.
","Forslaget blev vedtaget. For stemte 99 (S, V, SF, RV, EL, KF, DF, LA, FG, Bent Bøgsted (UFG), Hans Kristian Skibby (UFG), Marie Krarup (UFG) og Naser Khader (UFG)), imod stemte 0, hverken for eller imod stemte 2 (NB).",Transportministeriet,1.0,1.0,1.0,1.0,1.0,,1.0,1.0,,1.0,1.0,,,,15
9,84918,153,L 23,Forslag til lov om ændring af straffeloven og forskellige andre love. (Selvstændig bestemmelse om angreb med genstand på personer i offentlig tjeneste og skærpelse af straffen for forsætlig fareforvoldelse).,Om angreb med genstand på personer i offentlig tjeneste og skærpelse af straffen for fareforvoldelse.,"Lovforslaget indeholder for det første et forslag om at indføre en selvstændig bestemmelse om angreb med genstande på personer, der handler i offentlig tjeneste eller hverv, herunder politi og beredskab. 

For det andet foreslås det at skærpe straffen for at forvolde nærliggende fare for nogens liv eller førlighed ved at kaste eller affyre genstande mod andre. Det forudsættes i begge tilfælde, at straffen skal forhøjes med omkring en tredjedel i forhold til den straf, der hidtil har været fastsat af domstolene i sådanne sager.

Med forslaget ønsker regeringen bl.a. på baggrund af episoder i slutningen af december 2019, hvor fyrværkeri blev affyret mod uskyldige mennesker på gaden og mod politiet og beredskabet - og der har også siden været situationer, hvor myndighedspersoner er blevet angrebet med fyrværkeri, stenkast og lignende, når de har været til stede i bestemte områder - at sætte hårdt ind over for den slags utryghedsskabende og antisocial adfærd, så personalet sikres trygge og gode arbejdsvilkår, uanset hvor eller hvornår de rykker ud, og så folk kan færdes frit på gaden uden at frygte for pludselig at blive beskudt med fyrværkeri eller lignende.

Det foreslås, at lovforslaget træder i kraft den 15. december 2020.




","Forslaget blev vedtaget. For stemte 86 (S, V, DF, RV, SF, KF, NB og LA), imod stemte 3 (ALT,  Susanne Zimmer (UFG) og Uffe Elbæk (UFG)), hverken for eller imod stemte 7 (EL).",Justitsministeriet,1.0,1.0,1.0,1.0,,,1.0,1.0,1.0,1.0,,0.0,,,16
144,86766,153,L 141,Forslag til lov om ændring af straffeloven og lov om erstatningsansvar. (Styrket indsats mod farlig kørsel m.v.).,Om styrket indsats mod farlig kørsel m.v.,"Lovforslaget gennemfører de dele af den politiske aftale, som regeringen i december 2020 indgik med Venstre, Dansk Folkeparti, Radikale Venstre, Socialistisk Folkeparti, Enhedslisten, Det Konservative Folkeparti og Nye Borgerlige om gennemførelse af initiativerne i regeringens udspil ""Vanvidskørsel skal stoppes"" samt en række nye initiativer til bekæmpelse af vanvidskørsel, som forudsætter ændringer af straffeloven.
Lovforslaget indeholder en række forslag til markante strafskærpelser, herunder et forslag om at skærpe strafniveauet for overtrædelse af straffelovens § 241, 2. pkt., om uagtsomt manddrab under særligt skærpende omstændigheder med 150 pct., dvs. at forhøje bestemmelsens strafferamme fra 8 år til 10 år.
Lovforslaget indeholder endvidere forslag om at skærpe strafniveauet for overtrædelse af straffelovens § 249, 2. pkt., om uagtsom betydelig legemsbeskadigelse under særligt skærpende omstændigheder med 100 pct., at straffen for overtrædelse af straffelovens § 252, stk. 1, ved forsætligt at volde fare for andres liv eller førlighed i forbindelse med færdselslovsovertrædelser samt overtrædelse af straffelovens § 253, stk. 2, om flugtbilisme, skærpes med 50 pct.
Der lægges endvidere op til at skærpe straffen for personer, der ved chikanøs kørsel lægger hindringer i vejen for politiets eftersætning af en anden bil, så man går fra bøde til et udgangspunkt om ubetinget fængsel i 20 dage i førstegangstilfælde.
Herudover lægges der op til at udvide kredsen af personer, der i dag som udgangspunkt er berettigede til godtgørelse til efterladte til også at omfatte voksne, udeboende børn, forældre til voksne, udeboende børn og samboende søskende.
Lovforslaget foreslås at træde i kraft den 1. marts 2021.
","Forslaget blev vedtaget. For stemte 96 (S, V, DF, SF, RV, EL, KF, NB, LA, ALT, Jens Rohde (UFG), Susanne Zimmer (UFG) og Uffe Elbæk (UFG)), imod stemte 0, hverken for eller imod stemte 0.",Justitsministeriet,1.0,1.0,1.0,1.0,1.0,,1.0,1.0,1.0,1.0,,1.0,,,17
