index,id,periodeid,nummer,titel,titelkort,resume,afstemningskonklusion,ministeromraade,stem_S,stem_V,stem_SF,stem_RV,stem_EL,stem_DD,stem_KF,stem_DF,stem_NB,stem_LA,stem_FG,stem_ALT,stem_KD,stem_M,raekkenr
313,90138,155,L 78,"Forslag til lov om ændring af straffeloven, retsplejeloven og lov om pas til danske statsborgere m.v. (Styrket indsats mod seksuelle overgreb mod børn og styrket rådgivning til ofre for seksuelle overgreb).",Om styrket indsats mod seksuelle overgreb mod børn og styrket rådgivning til ofre for seksuelle overgreb m.v.,"Med lovforslaget ønsker man bl.a. at styrke indsatsen mod seksuelle overgreb mod børn og at styrke rådgivningen til ofre for seksuelle overgreb ved at gennemføre centrale dele af regeringens udspil af 17. maj 2021 ”Værn mod voksne, der krænker børn”.

Det foreslås for det første at ændre straffeloven, så der fremover pr. definition vil være tale om voldtægt i en situation, hvor forurettede er under 15 år, og gerningspersonen er fyldt 22 år. Herudover foreslås det, at straffen for andre seksuelle overgreb end samleje begået mod børn forhøjes med 50 pct. i forhold til den straf, der hidtil har været fastsat af domstolene for sådanne overtrædelser, og at der indføres et forbud mod sexdukker, der fremstår som børn.

Det foreslås endvidere at give domstolene mulighed for at idømme udrejseforbud til personer, der dømmes for seksuelle overgreb mod børn. Udrejseforbuddet foreslås suppleret af, at politiet skal inddrage den dømtes pas. Endelig foreslås, at politiet får mulighed for at foretage hemmelige ransagninger i sager om besiddelse og udbredelse af seksuelt overgrebsmateriale med børn (børnepornografi).

Derudover har lovforslaget også til formål at gennemføre de dele af aftalen af 22. juni 2021, der blev indgået som opfølgning på finansloven for 2021 mellem regeringen, Radikale Venstre, Socialistisk Folkeparti, Enhedslisten og Alternativet om styrket rådgivning for ofre for seksuelle overgreb, som forudsætter lovændringer. Derfor indeholder det også forslag om, at ofre for seksuelle overgreb får ret til at modtage vederlagsfri bistand fra en advokat forud for eventuel anmeldelse af overgrebet til politiet efter sagens eller retshandlingens afslutning.

Det foreslås, at loven træder i kraft den 1. marts 2022.
","Forslaget blev vedtaget. For stemte 106 (S, V, DF, SF, RV, EL, KF, LA, FG og ALT), imod stemte 0, hverken for eller imod stemte 0.",Justitsministeriet,1.0,1.0,1.0,1.0,1.0,,1.0,1.0,,1.0,1.0,1.0,,,18
462,92597,155,L 162 C,"Forslag til lov om ændring af straffeloven, lov om social service og lov om fuldbyrdelse af straf m.v. (Indførelse af særvilkår om økonomisk kontrol og målrettede forældrepålæg og børne- og ungepålæg ved utryghedsskabende adfærd).",Om indførelse af særvilkår om økonomisk kontrol og målrettede forældrepålæg og børne- og ungepålæg ved utryghedsskabende adfærd.,,"Forslaget blev vedtaget. For stemte 65 (S, V, KF, DF, LA, Bent Bøgsted (UFG), Hans Kristian Skibby (UFG), Karina Adsbøl (UFG), Naser Khader (UFG) og Orla Østerby (UFG)), imod stemte 31 (SF, RV, EL, NB, FG og ALT), hverken for eller imod stemte 0.",Justitsministeriet,1.0,1.0,0.0,0.0,0.0,,1.0,1.0,0.0,1.0,0.0,0.0,,,19
